{
  "schema_version": "paraflow.scalar-profile-report/v1",
  "started_at": "2026-07-26T01:29:27.907140629Z",
  "completed_at": "2026-07-26T01:29:30.131021825Z",
  "suite": {
    "path": "benchmarks/suites/day06-scalar-profile-v1.json",
    "sha256": "016f56cebcbbb5298ca5a32cf4058d6454a6863e4af7261a122a0718de734d3c",
    "schema_version": "paraflow.benchmark-suite/v1",
    "name": "day06-scalar-profile-v1"
  },
  "controller": {
    "version": "0.1.0-alpha.3",
    "full_commit": "df96257800abfb26500c4f3d28bba9b6ace31ebd",
    "source_state": "clean"
  },
  "environment": {
    "schema_version": "paraflow.environment/v3",
    "milestone": "day-06",
    "captured_at": "2026-07-26T01:29:28.105670972Z",
    "os": "linux",
    "kernel_version": "6.12.13",
    "architecture": "amd64",
    "cpu_model": "AMD EPYC 9V74 80-Core Processor",
    "physical_cores": 9,
    "logical_cpus": 9,
    "gomaxprocs": 9,
    "go_version": "go1.24.0",
    "source": {
      "version": "0.1.0-alpha.3",
      "full_commit": "df96257800abfb26500c4f3d28bba9b6ace31ebd",
      "source_state": "clean"
    },
    "ready": true,
    "tools": [
      {
        "name": "git",
        "required_now": true,
        "introduced": "day-01",
        "purpose": "source history and reproducibility identity",
        "found": true,
        "usable": true,
        "path": "/usr/bin/git",
        "version": "git version 2.43.0"
      },
      {
        "name": "go",
        "required_now": true,
        "minimum_version": "1.24.0",
        "introduced": "day-01",
        "purpose": "experiment control plane",
        "found": true,
        "usable": true,
        "path": "/workspace/scratch/bb063b194b24/.toolchains/go1.24.0/bin/go",
        "version": "go version go1.24.0 linux/amd64"
      },
      {
        "name": "rustc",
        "required_now": true,
        "minimum_version": "1.97.1",
        "introduced": "day-01",
        "purpose": "execution engine compiler",
        "found": true,
        "usable": true,
        "path": "/workspace/scratch/bb063b194b24/.toolchains/cargo/bin/rustc",
        "version": "rustc 1.97.1 (8bab26f4f 2026-07-14)"
      },
      {
        "name": "cargo",
        "required_now": true,
        "minimum_version": "1.97.1",
        "introduced": "day-01",
        "purpose": "Rust build and test orchestration",
        "found": true,
        "usable": true,
        "path": "/workspace/scratch/bb063b194b24/.toolchains/cargo/bin/cargo",
        "version": "cargo 1.97.1 (c980f4866 2026-06-30)"
      },
      {
        "name": "cc",
        "required_now": true,
        "introduced": "day-01",
        "purpose": "C toolchain required by Go race-detector tests",
        "found": true,
        "usable": true,
        "path": "/usr/bin/cc",
        "version": "cc (Ubuntu 13.3.0-6ubuntu2~24.04) 13.3.0"
      },
      {
        "name": "node",
        "required_now": true,
        "minimum_version": "20.0.0",
        "introduced": "day-01",
        "purpose": "Draft 2020-12 contract validation",
        "found": true,
        "usable": true,
        "path": "/opt/codex/runtimes/codex-primary-runtime/dependencies/node/bin/node",
        "version": "v24.14.0"
      },
      {
        "name": "npm",
        "required_now": true,
        "introduced": "day-01",
        "purpose": "reproducible schema-validator installation",
        "found": true,
        "usable": true,
        "path": "/opt/codex/runtimes/codex-primary-runtime/dependencies/node/bin/npm",
        "version": "11.9.0"
      },
      {
        "name": "rustfmt",
        "required_now": true,
        "introduced": "day-01",
        "purpose": "Rust formatting gate",
        "found": true,
        "usable": true,
        "path": "/workspace/scratch/bb063b194b24/.toolchains/cargo/bin/rustfmt",
        "version": "rustfmt 1.9.0-stable (8bab26f4f6 2026-07-14)"
      },
      {
        "name": "clippy",
        "required_now": true,
        "introduced": "day-01",
        "purpose": "Rust lint gate",
        "found": true,
        "usable": true,
        "path": "/workspace/scratch/bb063b194b24/.toolchains/cargo/bin/cargo",
        "version": "clippy 0.1.97 (8bab26f4f6 2026-07-14)"
      },
      {
        "name": "bash",
        "required_now": true,
        "minimum_version": "4.0.0",
        "introduced": "day-01",
        "purpose": "repository scripts and workload discovery",
        "found": true,
        "usable": true,
        "path": "/usr/bin/bash",
        "version": "GNU bash, version 5.2.21(1)-release (x86_64-pc-linux-gnu)"
      },
      {
        "name": "make",
        "required_now": true,
        "introduced": "day-01",
        "purpose": "repository quality-gate orchestration",
        "found": true,
        "usable": true,
        "path": "/usr/bin/make",
        "version": "GNU Make 4.3"
      },
      {
        "name": "c++",
        "required_now": false,
        "introduced": "week-02",
        "purpose": "native scalar, SIMD, and CUDA host kernels",
        "found": true,
        "usable": true,
        "path": "/usr/bin/c++",
        "version": "c++ (Ubuntu 13.3.0-6ubuntu2~24.04) 13.3.0"
      },
      {
        "name": "ispc",
        "required_now": false,
        "introduced": "week-02",
        "purpose": "SPMD-to-SIMD kernels",
        "found": false,
        "usable": false,
        "problem": "exec: \"ispc\": executable file not found in $PATH"
      },
      {
        "name": "nvcc",
        "required_now": false,
        "introduced": "week-09",
        "purpose": "CUDA backend",
        "found": false,
        "usable": false,
        "problem": "exec: \"nvcc\": executable file not found in $PATH"
      }
    ]
  },
  "engine_artifact": {
    "path": "target/release/paraflow-engine",
    "sha256": "52c96acdaeaa6e996adfe9362c18d99918c34205c8bb6a26a64da7c4906f3b76"
  },
  "experiments": [
    {
      "scenario_name": "scalar-uniform-1k",
      "workload": {
        "path": "workloads/bench-uniform-1k-v1.json",
        "sha256": "9f4478c757be0205734e9699952bd345f758ef877fe12506fb35a5df1d2ac695",
        "schema_version": "paraflow.workload/v1",
        "name": "bench-uniform-1k-v1",
        "record_count": 1024,
        "category_count": 16,
        "distribution": "uniform"
      },
      "baseline": {
        "orchestration_total_ns": "0x000000000020e6f8",
        "engine_result": {
          "schema_version": "paraflow.benchmark-engine-result/v1",
          "experiment_id": "day06:baseline:0000000000000001",
          "scenario_name": "scalar-uniform-1k",
          "workload_name": "bench-uniform-1k-v1",
          "execution": {
            "backend": "scalar"
          },
          "sampling": {
            "warmup_iterations": 5,
            "sample_iterations": 25
          },
          "timing": {
            "clock": "std::time::Instant",
            "unit": "nanoseconds",
            "process_start_in_samples": false,
            "experiment_total_ns": "0x000000000006f059"
          },
          "correctness": {
            "status": "passed",
            "oracle": "rust-scalar-v1",
            "comparison": "exact"
          },
          "engine_build": {
            "version": "0.1.0-alpha.3",
            "profile": "release",
            "target": "x86_64-unknown-linux-gnu",
            "rustc": "rustc 1.97.1 (8bab26f4f 2026-07-14)",
            "source_commit": "df96257800abfb26500c4f3d28bba9b6ace31ebd",
            "source_state": "clean"
          },
          "samples": [
            {
              "ordinal": 0,
              "generation_ns": "0x000000000000429f",
              "pipeline_ns": "0x0000000000000a18",
              "engine_total_ns": "0x0000000000004d4d"
            },
            {
              "ordinal": 1,
              "generation_ns": "0x0000000000002cf3",
              "pipeline_ns": "0x00000000000009d1",
              "engine_total_ns": "0x000000000000371e"
            },
            {
              "ordinal": 2,
              "generation_ns": "0x0000000000002cc1",
              "pipeline_ns": "0x000000000000098b",
              "engine_total_ns": "0x00000000000036b0"
            },
            {
              "ordinal": 3,
              "generation_ns": "0x0000000000002cb7",
              "pipeline_ns": "0x0000000000000964",
              "engine_total_ns": "0x000000000000367f"
            },
            {
              "ordinal": 4,
              "generation_ns": "0x0000000000002cd5",
              "pipeline_ns": "0x0000000000000900",
              "engine_total_ns": "0x000000000000362f"
            },
            {
              "ordinal": 5,
              "generation_ns": "0x0000000000002cb7",
              "pipeline_ns": "0x0000000000000913",
              "engine_total_ns": "0x0000000000003624"
            },
            {
              "ordinal": 6,
              "generation_ns": "0x0000000000002cb7",
              "pipeline_ns": "0x00000000000008f5",
              "engine_total_ns": "0x0000000000003610"
            },
            {
              "ordinal": 7,
              "generation_ns": "0x0000000000002ccb",
              "pipeline_ns": "0x00000000000008e2",
              "engine_total_ns": "0x0000000000003607"
            },
            {
              "ordinal": 8,
              "generation_ns": "0x0000000000002d07",
              "pipeline_ns": "0x00000000000008e1",
              "engine_total_ns": "0x0000000000003642"
            },
            {
              "ordinal": 9,
              "generation_ns": "0x0000000000002cd5",
              "pipeline_ns": "0x00000000000008d7",
              "engine_total_ns": "0x0000000000003606"
            },
            {
              "ordinal": 10,
              "generation_ns": "0x0000000000002ccb",
              "pipeline_ns": "0x00000000000008f6",
              "engine_total_ns": "0x000000000000361b"
            },
            {
              "ordinal": 11,
              "generation_ns": "0x0000000000002ccb",